{
  "schema_version": "1.0.0",
  "manifest_kind": "lightweight-resolution-manifest",
  "manifest_id": "LRM-001",
  "issue_id": "ISSUE-001",
  "manifest_revision": "rev-0001",
  "sequence": 1,
  "previous_manifest_ref": null,
  "manifest_anchor_id": null,
  "entries": [
    {
      "entry_id": "LRM-E-001",
      "action": "add",
      "artifact_key": {
        "artifact_id": "ART-001",
        "artifact_revision": "rev-0001"
      },
      "storage_class": "repository-redacted",
      "immutable_locator": "samples/valid/r4-s-execution-ledger.min.json",
      "sha256": "aaaaaaaaaaaaaaaaaaaaaaaaaaaaaaaaaaaaaaaaaaaaaaaaaaaaaaaaaaaaaaaa",
      "git_blob_id": "blob-001",
      "digest_status": "public-digest",
      "digest_optional_reason": null,
      "supersedes_entry_id": null,
      "reason": null,
      "registered_at": "2026-06-16T00:00:00Z",
      "registered_by": "human"
    }
  ]
}
